{
  "schemaVersion": 1,
  "kind": "bootstrap",
  "scope": "isolated-preview",
  "evidenceAsOf": "2026-09-29T16:28:20.814Z",
  "priceBasis": "TWSE-unadjusted-close",
  "history": [
    {
      "schemaVersion": 1,
      "kind": "signal-close",
      "purpose": "eod-reconciliation",
      "symbol": "0050",
      "tradeDate": "2026-05-04",
      "close": 94.6,
      "source": "https://www.twse.com.tw/exchangeReport/STOCK_DAY?response=json&date=20260501&stockNo=0050",
      "sourceEventAt": null,
      "retrievedAt": "2026-09-29T10:26:05.789Z",
      "rawPayloadHash": "8b60db9708ec4ae1f5af29a5b4d4d92d0dc94c2263d73215a5512bd1774526fc",
      "parserVersion": "ingestion-poc/1.0.0"
    },
    {
      "schemaVersion": 1,
      "kind": "signal-close",
      "purpose": "eod-reconciliation",
      "symbol": "0050",
      "tradeDate": "2026-05-05",
      "close": 94.6,
      "source": "https://www.twse.com.tw/exchangeReport/STOCK_DAY?response=json&date=20260501&stockNo=0050",
      "sourceEventAt": null,
      "retrievedAt": "2026-09-29T10:26:05.789Z",
      "rawPayloadHash": "8b60db9708ec4ae1f5af29a5b4d4d92d0dc94c2263d73215a5512bd1774526fc",
      "parserVersion": "ingestion-poc/1.0.0"
    },
    {
      "schemaVersion": 1,
      "kind": "signal-close",
      "purpose": "eod-reconciliation",
      "symbol": "0050",
      "tradeDate": "2026-05-06",
      "close": 95.75,
      "source": "https://www.twse.com.tw/exchangeReport/STOCK_DAY?response=json&date=20260501&stockNo=0050",
      "sourceEventAt": null,
      "retrievedAt": "2026-09-29T10:26:05.789Z",
      "rawPayloadHash": "8b60db9708ec4ae1f5af29a5b4d4d92d0dc94c2263d73215a5512bd1774526fc",
      "parserVersion": "ingestion-poc/1.0.0"
    },
    {
      "schemaVersion": 1,
      "kind": "signal-close",
      "purpose": "eod-reconciliation",
      "symbol": "0050",
      "tradeDate": "2026-05-07",
      "close": 97.7,
      "source": "https://www.twse.com.tw/exchangeReport/STOCK_DAY?response=json&date=20260501&stockNo=0050",
      "sourceEventAt": null,
      "retrievedAt": "2026-09-29T10:26:05.789Z",
      "rawPayloadHash": "8b60db9708ec4ae1f5af29a5b4d4d92d0dc94c2263d73215a5512bd1774526fc",
      "parserVersion": "ingestion-poc/1.0.0"
    },
    {
      "schemaVersion": 1,
      "kind": "signal-close",
      "purpose": "eod-reconciliation",
      "symbol": "0050",
      "tradeDate": "2026-05-08",
      "close": 97,
      "source": "https://www.twse.com.tw/exchangeReport/STOCK_DAY?response=json&date=20260501&stockNo=0050",
      "sourceEventAt": null,
      "retrievedAt": "2026-09-29T10:26:05.789Z",
      "rawPayloadHash": "8b60db9708ec4ae1f5af29a5b4d4d92d0dc94c2263d73215a5512bd1774526fc",
      "parserVersion": "ingestion-poc/1.0.0"
    },
    {
      "schemaVersion": 1,
      "kind": "signal-close",
      "purpose": "eod-reconciliation",
      "symbol": "0050",
      "tradeDate": "2026-05-11",
      "close": 96.9,
      "source": "https://www.twse.com.tw/exchangeReport/STOCK_DAY?response=json&date=20260501&stockNo=0050",
      "sourceEventAt": null,
      "retrievedAt": "2026-09-29T10:26:05.789Z",
      "rawPayloadHash": "8b60db9708ec4ae1f5af29a5b4d4d92d0dc94c2263d73215a5512bd1774526fc",
      "parserVersion": "ingestion-poc/1.0.0"
    },
    {
      "schemaVersion": 1,
      "kind": "signal-close",
      "purpose": "eod-reconciliation",
      "symbol": "0050",
      "tradeDate": "2026-05-12",
      "close": 96.85,
      "source": "https://www.twse.com.tw/exchangeReport/STOCK_DAY?response=json&date=20260501&stockNo=0050",
      "sourceEventAt": null,
      "retrievedAt": "2026-09-29T10:26:05.789Z",
      "rawPayloadHash": "8b60db9708ec4ae1f5af29a5b4d4d92d0dc94c2263d73215a5512bd1774526fc",
      "parserVersion": "ingestion-poc/1.0.0"
    },
    {
      "schemaVersion": 1,
      "kind": "signal-close",
      "purpose": "eod-reconciliation",
      "symbol": "0050",
      "tradeDate": "2026-05-13",
      "close": 95.5,
      "source": "https://www.twse.com.tw/exchangeReport/STOCK_DAY?response=json&date=20260501&stockNo=0050",
      "sourceEventAt": null,
      "retrievedAt": "2026-09-29T10:26:05.789Z",
      "rawPayloadHash": "8b60db9708ec4ae1f5af29a5b4d4d92d0dc94c2263d73215a5512bd1774526fc",
      "parserVersion": "ingestion-poc/1.0.0"
    },
    {
      "schemaVersion": 1,
      "kind": "signal-close",
      "purpose": "eod-reconciliation",
      "symbol": "0050",
      "tradeDate": "2026-05-14",
      "close": 96.05,
      "source": "https://www.twse.com.tw/exchangeReport/STOCK_DAY?response=json&date=20260501&stockNo=0050",
      "sourceEventAt": null,
      "retrievedAt": "2026-09-29T10:26:05.789Z",
      "rawPayloadHash": "8b60db9708ec4ae1f5af29a5b4d4d92d0dc94c2263d73215a5512bd1774526fc",
      "parserVersion": "ingestion-poc/1.0.0"
    },
    {
      "schemaVersion": 1,
      "kind": "signal-close",
      "purpose": "eod-reconciliation",
      "symbol": "0050",
      "tradeDate": "2026-05-15",
      "close": 95.4,
      "source": "https://www.twse.com.tw/exchangeReport/STOCK_DAY?response=json&date=20260501&stockNo=0050",
      "sourceEventAt": null,
      "retrievedAt": "2026-09-29T10:26:05.789Z",
      "rawPayloadHash": "8b60db9708ec4ae1f5af29a5b4d4d92d0dc94c2263d73215a5512bd1774526fc",
      "parserVersion": "ingestion-poc/1.0.0"
    },
    {
      "schemaVersion": 1,
      "kind": "signal-close",
      "purpose": "eod-reconciliation",
      "symbol": "0050",
      "tradeDate": "2026-05-18",
      "close": 94.9,
      "source": "https://www.twse.com.tw/exchangeReport/STOCK_DAY?response=json&date=20260501&stockNo=0050",
      "sourceEventAt": null,
      "retrievedAt": "2026-09-29T10:26:05.789Z",
      "rawPayloadHash": "8b60db9708ec4ae1f5af29a5b4d4d92d0dc94c2263d73215a5512bd1774526fc",
      "parserVersion": "ingestion-poc/1.0.0"
    },
    {
      "schemaVersion": 1,
      "kind": "signal-close",
      "purpose": "eod-reconciliation",
      "symbol": "0050",
      "tradeDate": "2026-05-19",
      "close": 93.1,
      "source": "https://www.twse.com.tw/exchangeReport/STOCK_DAY?response=json&date=20260501&stockNo=0050",
      "sourceEventAt": null,
      "retrievedAt": "2026-09-29T10:26:05.789Z",
      "rawPayloadHash": "8b60db9708ec4ae1f5af29a5b4d4d92d0dc94c2263d73215a5512bd1774526fc",
      "parserVersion": "ingestion-poc/1.0.0"
    },
    {
      "schemaVersion": 1,
      "kind": "signal-close",
      "purpose": "eod-reconciliation",
      "symbol": "0050",
      "tradeDate": "2026-05-20",
      "close": 92.5,
      "source": "https://www.twse.com.tw/exchangeReport/STOCK_DAY?response=json&date=20260501&stockNo=0050",
      "sourceEventAt": null,
      "retrievedAt": "2026-09-29T10:26:05.789Z",
      "rawPayloadHash": "8b60db9708ec4ae1f5af29a5b4d4d92d0dc94c2263d73215a5512bd1774526fc",
      "parserVersion": "ingestion-poc/1.0.0"
    },
    {
      "schemaVersion": 1,
      "kind": "signal-close",
      "purpose": "eod-reconciliation",
      "symbol": "0050",
      "tradeDate": "2026-05-21",
      "close": 95.85,
      "source": "https://www.twse.com.tw/exchangeReport/STOCK_DAY?response=json&date=20260501&stockNo=0050",
      "sourceEventAt": null,
      "retrievedAt": "2026-09-29T10:26:05.789Z",
      "rawPayloadHash": "8b60db9708ec4ae1f5af29a5b4d4d92d0dc94c2263d73215a5512bd1774526fc",
      "parserVersion": "ingestion-poc/1.0.0"
    },
    {
      "schemaVersion": 1,
      "kind": "signal-close",
      "purpose": "eod-reconciliation",
      "symbol": "0050",
      "tradeDate": "2026-05-22",
      "close": 97.3,
      "source": "https://www.twse.com.tw/exchangeReport/STOCK_DAY?response=json&date=20260501&stockNo=0050",
      "sourceEventAt": null,
      "retrievedAt": "2026-09-29T10:26:05.789Z",
      "rawPayloadHash": "8b60db9708ec4ae1f5af29a5b4d4d92d0dc94c2263d73215a5512bd1774526fc",
      "parserVersion": "ingestion-poc/1.0.0"
    },
    {
      "schemaVersion": 1,
      "kind": "signal-close",
      "purpose": "eod-reconciliation",
      "symbol": "0050",
      "tradeDate": "2026-05-25",
      "close": 100.8,
      "source": "https://www.twse.com.tw/exchangeReport/STOCK_DAY?response=json&date=20260501&stockNo=0050",
      "sourceEventAt": null,
      "retrievedAt": "2026-09-29T10:26:05.789Z",
      "rawPayloadHash": "8b60db9708ec4ae1f5af29a5b4d4d92d0dc94c2263d73215a5512bd1774526fc",
      "parserVersion": "ingestion-poc/1.0.0"
    },
    {
      "schemaVersion": 1,
      "kind": "signal-close",
      "purpose": "eod-reconciliation",
      "symbol": "0050",
      "tradeDate": "2026-05-26",
      "close": 100.1,
      "source": "https://www.twse.com.tw/exchangeReport/STOCK_DAY?response=json&date=20260501&stockNo=0050",
      "sourceEventAt": null,
      "retrievedAt": "2026-09-29T10:26:05.789Z",
      "rawPayloadHash": "8b60db9708ec4ae1f5af29a5b4d4d92d0dc94c2263d73215a5512bd1774526fc",
      "parserVersion": "ingestion-poc/1.0.0"
    },
    {
      "schemaVersion": 1,
      "kind": "signal-close",
      "purpose": "eod-reconciliation",
      "symbol": "0050",
      "tradeDate": "2026-05-27",
      "close": 102.55,
      "source": "https://www.twse.com.tw/exchangeReport/STOCK_DAY?response=json&date=20260501&stockNo=0050",
      "sourceEventAt": null,
      "retrievedAt": "2026-09-29T10:26:05.789Z",
      "rawPayloadHash": "8b60db9708ec4ae1f5af29a5b4d4d92d0dc94c2263d73215a5512bd1774526fc",
      "parserVersion": "ingestion-poc/1.0.0"
    },
    {
      "schemaVersion": 1,
      "kind": "signal-close",
      "purpose": "eod-reconciliation",
      "symbol": "0050",
      "tradeDate": "2026-05-28",
      "close": 100.5,
      "source": "https://www.twse.com.tw/exchangeReport/STOCK_DAY?response=json&date=20260501&stockNo=0050",
      "sourceEventAt": null,
      "retrievedAt": "2026-09-29T10:26:05.789Z",
      "rawPayloadHash": "8b60db9708ec4ae1f5af29a5b4d4d92d0dc94c2263d73215a5512bd1774526fc",
      "parserVersion": "ingestion-poc/1.0.0"
    },
    {
      "schemaVersion": 1,
      "kind": "signal-close",
      "purpose": "eod-reconciliation",